{
  "generatedAt": "2026-05-02T20:17:20.628Z",
  "baselinePath": "/Users/jonathanreed/Downloads/NautilusBot/nautilus-bot/docs/evals/benchmark-run-baseline.json",
  "candidatePath": "/Users/jonathanreed/Downloads/NautilusBot/nautilus-bot/docs/evals/benchmark-run-packaged-macos.json",
  "schemaPath": "/Users/jonathanreed/Downloads/NautilusBot/nautilus-bot/docs/evals/benchmark-run.schema.json",
  "thresholds": {
    "commandMin": 0.95,
    "snippetMin": 0.99,
    "latencyImprovementMin": 0.25
  },
  "metrics": {
    "baselineP50EndToEndMs": 400.4,
    "candidateP50EndToEndMs": 286,
    "latencyImprovement": 0.2857142857142857,
    "commandSuccessRate": 1,
    "snippetSuccessRate": 1
  },
  "checks": [
    {
      "id": "cp13-command-success",
      "pass": true,
      "actual": 1,
      "required": 0.95,
      "comparator": ">="
    },
    {
      "id": "cp14-snippet-success",
      "pass": true,
      "actual": 1,
      "required": 0.99,
      "comparator": ">="
    },
    {
      "id": "cp15-latency-improvement",
      "pass": true,
      "actual": 0.2857142857142857,
      "required": 0.25,
      "comparator": ">="
    },
    {
      "id": "cp15-provider-integrity",
      "pass": true,
      "actual": "ok",
      "required": "0 issues",
      "comparator": "==",
      "details": []
    }
  ],
  "pass": true
}
